{
  "type": "MEASUREMENTS_CAPTURED",
  "source": "collect_quality_measurements",
  "occurredAt": "2026-07-08T15:05:00.000Z",
  "payload": {
    "measurementSetId": "MS-CPK-002",
    "partNumber": "PN-9002",
    "characteristic": "slot width",
    "measurements": [5.01, 5.08, 4.95, 5.12, 4.91, 5.06, 4.98, 5.1],
    "lsl": 4.9,
    "usl": 5.1,
    "target": 5.0,
    "minimumCpk": 1.33
  }
}

